{"kind":"repomap-git","version":1,"generatedAt":"2026-09-24T10:05:28.000Z","repo":{"name":"bookshelf (demo)","head":{"branch":"feature/wishlist","commit":"f6d1608f580c28be21a45c21032dc9c076f9d4fb"},"defaultBranch":"main","remotes":[{"name":"origin","url":"https://git.example.com/acme/bookshelf.git"}]},"commits":[{"hash":"f6d1608f580c28be21a45c21032dc9c076f9d4fb","parents":["453b36fb1876b7d661b4692944d106e49578ae37"],"author":"Lena Novak","date":1790240728,"subject":"Wishlist page","files":[{"path":"web/src/features/wishlist/WishlistPage.tsx","status":"A","additions":85,"deletions":0},{"path":"web/src/App.tsx","status":"M","additions":32,"deletions":10}],"stats":{"files":2,"additions":117,"deletions":10}},{"hash":"793dac2b1738e34250a0336163f3a0587db8ca7f","parents":["89d5bcb4cf5207bd4654f27e32197f0f0d5c1b78"],"author":"Tom Okafor","date":1790161312,"subject":"Bump Playwright","files":[{"path":"web/package.json","status":"M","additions":16,"deletions":1},{"path":".github/workflows/ci.yml","status":"M","additions":41,"deletions":12}],"stats":{"files":2,"additions":57,"deletions":13}},{"hash":"89d5bcb4cf5207bd4654f27e32197f0f0d5c1b78","parents":["2199483fc4f7ced2566f5b8504541158b158d963"],"author":"Mia Santos","date":1790154870,"subject":"Fix the customers page on small screens","files":[{"path":"web/src/features/customers/CustomersPage.tsx","status":"M","additions":16,"deletions":5},{"path":"web/src/index.css","status":"M","additions":38,"deletions":4}],"stats":{"files":2,"additions":54,"deletions":9}},{"hash":"453b36fb1876b7d661b4692944d106e49578ae37","parents":["bd4a5a0d6694b9387390af933ff1592e558926a9"],"author":"Lena Novak","date":1790066897,"subject":"Wishlist button on book cards","files":[{"path":"web/src/features/wishlist/useWishlist.ts","status":"A","additions":127,"deletions":0},{"path":"web/src/features/books/BookCard.tsx","status":"M","additions":24,"deletions":6}],"stats":{"files":2,"additions":151,"deletions":6}},{"hash":"bd4a5a0d6694b9387390af933ff1592e558926a9","parents":["2199483fc4f7ced2566f5b8504541158b158d963"],"author":"Lena Novak","date":1790009795,"subject":"Wishlist entity and endpoints","files":[{"path":"api/src/Bookshelf.Api/Features/Wishlist/WishlistEndpoints.cs","status":"A","additions":121,"deletions":0},{"path":"api/src/Bookshelf.Api/Data/AppDbContext.cs","status":"M","additions":37,"deletions":6},{"path":"api/src/Bookshelf.Api/Data/Migrations/AppDbContextModelSnapshot.cs","status":"M","additions":16,"deletions":8}],"stats":{"files":3,"additions":174,"deletions":14}},{"hash":"a216c1679ab0aeeadcee0d11b98f820c76be4933","parents":["2199483fc4f7ced2566f5b8504541158b158d963"],"author":"Ravi Mehta","date":1790003237,"subject":"Paginate reviews on the book page","files":[{"path":"api/src/Bookshelf.Api/Features/Reviews/ReviewsEndpoints.cs","status":"M","additions":21,"deletions":11},{"path":"web/src/features/reviews/ReviewList.tsx","status":"M","additions":3,"deletions":1},{"path":"web/src/features/reviews/useReviews.ts","status":"M","additions":10,"deletions":5}],"stats":{"files":3,"additions":34,"deletions":17}},{"hash":"2199483fc4f7ced2566f5b8504541158b158d963","parents":["6e42cfe48d8e69d3492636d2c2639f3994fa3a60"],"author":"Ada Park","date":1789989096,"subject":"Update the README screenshots","files":[{"path":"README.md","status":"M","additions":4,"deletions":2}],"stats":{"files":1,"additions":4,"deletions":2}},{"hash":"6e42cfe48d8e69d3492636d2c2639f3994fa3a60","parents":["98e3a2aa3b0c2b2701956b18a4454db58532768e","6cc4d56624b096414d853604b947d2c71bcbf2fa"],"author":"Ada Park","date":1785839365,"subject":"Merge pull request #15 from acme/feature/notifications","committer":"GitHub","committedAt":1785839405,"body":"Order shipped emails","files":[{"path":"api/src/Bookshelf.Api/Features/Notifications/EmailService.cs","status":"M","additions":7,"deletions":1},{"path":"api/src/Bookshelf.Api/Program.cs","status":"M","additions":21,"deletions":10},{"path":"api/src/Bookshelf.Api/appsettings.json","status":"M","additions":23,"deletions":4},{"path":"api/src/Bookshelf.Api/Features/Orders/OrderService.cs","status":"M","additions":18,"deletions":7},{"path":"api/tests/Bookshelf.Api.UnitTests/OrderServiceTests.cs","status":"M","additions":6,"deletions":1}],"stats":{"files":5,"additions":75,"deletions":23},"pr":15},{"hash":"6cc4d56624b096414d853604b947d2c71bcbf2fa","parents":["ab7cc6bbf6fded3255c95add694b1bf42e0b11bf"],"author":"Tom Okafor","date":1785833603,"subject":"Notification tests","files":[{"path":"api/tests/Bookshelf.Api.UnitTests/OrderServiceTests.cs","status":"M","additions":22,"deletions":4}],"stats":{"files":1,"additions":22,"deletions":4}},{"hash":"98e3a2aa3b0c2b2701956b18a4454db58532768e","parents":["7068cf97a4084f3eac47f6b5b54fb58c204d08fb"],"author":"Ravi Mehta","date":1785777762,"subject":"Books: paginate the list endpoint","files":[{"path":"api/src/Bookshelf.Api/Features/Books/BooksEndpoints.cs","status":"M","additions":18,"deletions":1},{"path":"api/src/Bookshelf.Api/Features/Books/BookService.cs","status":"M","additions":27,"deletions":17},{"path":"web/src/features/books/useBooks.ts","status":"M","additions":38,"deletions":14}],"stats":{"files":3,"additions":83,"deletions":32}},{"hash":"ab7cc6bbf6fded3255c95add694b1bf42e0b11bf","parents":["1d1bf0d4087f37c1ff5172760475ec2351b93d78"],"author":"Tom Okafor","date":1785769699,"subject":"Send an email when an order ships","files":[{"path":"api/src/Bookshelf.Api/Features/Orders/OrderService.cs","status":"M","additions":12,"deletions":1},{"path":"api/src/Bookshelf.Api/Features/Notifications/EmailService.cs","status":"M","additions":27,"deletions":10}],"stats":{"files":2,"additions":39,"deletions":11}},{"hash":"1d1bf0d4087f37c1ff5172760475ec2351b93d78","parents":["7068cf97a4084f3eac47f6b5b54fb58c204d08fb"],"author":"Tom Okafor","date":1785756302,"subject":"Email service","files":[{"path":"api/src/Bookshelf.Api/Features/Notifications/EmailService.cs","status":"A","additions":146,"deletions":0},{"path":"api/src/Bookshelf.Api/Program.cs","status":"M","additions":30,"deletions":4},{"path":"api/src/Bookshelf.Api/appsettings.json","status":"M","additions":23,"deletions":4}],"stats":{"files":3,"additions":199,"deletions":8}},{"hash":"7068cf97a4084f3eac47f6b5b54fb58c204d08fb","parents":["76b7297fd95eeb80bbaa9725bc37d53e9706708b"],"author":"Ravi Mehta","date":1781860278,"subject":"Faster book search with a trigram index","files":[{"path":"api/src/Bookshelf.Api/Features/Books/BookService.cs","status":"M","additions":10,"deletions":1},{"path":"api/src/Bookshelf.Api/Data/AppDbContext.cs","status":"M","additions":40,"deletions":26},{"path":"api/src/Bookshelf.Api/Data/Migrations/AppDbContextModelSnapshot.cs","status":"M","additions":37,"deletions":2}],"stats":{"files":3,"additions":87,"deletions":29}},{"hash":"76b7297fd95eeb80bbaa9725bc37d53e9706708b","parents":["e2e1f86288746a990429428079a50ea72c7a991e"],"author":"Lena Novak","date":1781686881,"subject":"Shelves: organise books into shelves (#14)","committer":"GitHub","committedAt":1781686921,"files":[{"path":"api/src/Bookshelf.Api/Data/Shelf.cs","status":"A","additions":120,"deletions":0},{"path":"api/src/Bookshelf.Api/Data/AppDbContext.cs","status":"M","additions":40,"deletions":16},{"path":"api/src/Bookshelf.Api/Data/Migrations/20260601_AddShelfs.cs","status":"A","additions":36,"deletions":0},{"path":"api/src/Bookshelf.Api/Data/Migrations/AppDbContextModelSnapshot.cs","status":"M","additions":34,"deletions":0},{"path":"api/src/Bookshelf.Api/Features/Shelfs/ShelfService.cs","status":"A","additions":131,"deletions":0},{"path":"api/src/Bookshelf.Api/Features/Shelfs/ShelfsEndpoints.cs","status":"A","additions":116,"deletions":0},{"path":"api/tests/Bookshelf.Api.UnitTests/ShelfServiceTests.cs","status":"A","additions":61,"deletions":0},{"path":"api/tests/Bookshelf.Api.IntegrationTests/ShelfsEndpointTests.cs","status":"A","additions":77,"deletions":0},{"path":"web/src/features/shelfs/ShelfsPage.tsx","status":"A","additions":138,"deletions":0},{"path":"web/src/features/shelfs/ShelfList.tsx","status":"A","additions":149,"deletions":0},{"path":"web/src/features/shelfs/ShelfCard.tsx","status":"A","additions":81,"deletions":0},{"path":"web/src/features/shelfs/ShelfForm.tsx","status":"A","additions":59,"deletions":0},{"path":"web/src/features/shelfs/ShelfDetailPage.tsx","status":"A","additions":71,"deletions":0},{"path":"web/src/features/shelfs/useShelfs.ts","status":"A","additions":95,"deletions":0},{"path":"web/src/features/shelfs/ShelfsPage.test.tsx","status":"A","additions":40,"deletions":0},{"path":"web/e2e/shelfs.spec.ts","status":"A","additions":96,"deletions":0}],"stats":{"files":16,"additions":1344,"deletions":16},"pr":14},{"hash":"e2e1f86288746a990429428079a50ea72c7a991e","parents":["df7e702dfaac979a3378d0cbfea06788962c4e31"],"author":"dependabot[bot]","date":1781601846,"subject":"Bump Npgsql.EntityFrameworkCore.PostgreSQL from 10.0.0 to 10.0.1 (#11)","committer":"GitHub","committedAt":1781601886,"files":[{"path":"api/src/Bookshelf.Api/Bookshelf.Api.csproj","status":"M","additions":29,"deletions":9}],"stats":{"files":1,"additions":29,"deletions":9},"pr":11},{"hash":"df7e702dfaac979a3378d0cbfea06788962c4e31","parents":["a11ab79f5f94ba561eda8d550cdee20cc3b7e81b","0bdf566c895385871b5e690686aa0e01c3b4aa60"],"author":"Ada Park","date":1778144667,"subject":"Merge pull request #12 from acme/feature/customers","committer":"GitHub","committedAt":1778144707,"body":"Customers, and orders linked to them","files":[{"path":"api/src/Bookshelf.Api/Data/Customer.cs","status":"M","additions":16,"deletions":8},{"path":"api/src/Bookshelf.Api/Data/AppDbContext.cs","status":"M","additions":7,"deletions":3},{"path":"api/src/Bookshelf.Api/Data/Migrations/20260501_AddCustomers.cs","status":"M","additions":10,"deletions":0},{"path":"api/src/Bookshelf.Api/Data/Migrations/AppDbContextModelSnapshot.cs","status":"M","additions":10,"deletions":6},{"path":"api/src/Bookshelf.Api/Features/Customers/CustomerService.cs","status":"M","addi